,review,yuyong
1255,"좋다고 해서 써봣는데 순하긴 한 것 같지만 효과는 그닥,,??",0.0033
1256,독도스킨은 닦아내기에 아주 적합한 화장품 같아요. 부담 없고 가격도 착해요,0.0034
1257,"그냥 물 같아요
 토너로서의 기능이 있는지 모르겠디만,,,
 그냥 물바르는 느낌
 뾰루지가 나진 않았지만 개선되는 점도 하나도 없었어요
 복합성인데 저한텐 좀 건조하네요",0.0183
1258,"솔직히 독도토너 몇 통째 쓰는지 모르겠어요 ㅠ 이거 좋다고 계속 소리쳐서 이젠 피까지 나올 정도예요 ☠️ 그정도로 좋습니다.
 순해서 좋아요 ㅎㅎ",0.004
1259,"무난하게 사용하기 좋은 거 같아요
 양도 많아서 스킨팩, 7스킨 등 다양하게 활용 가능해요 !",0.0043
1260,작은병으로 몇개써보고 큰병으로 두개째 사용중인데 순하고 딱히 나쁜점 없어서 계속 쓰는중입니다 스킨팩도해서 좀 헤프게쓸대도 있어서 대용량으로 쓰면 딱입니당,0.005
1261,"저는 닦토를 하면 피부가 예민해서 조금 자극이 있어요 그래서 스프레이 용기에 넣어서 뿌려주고 흡수 시켜준다음 솜에 토너를 엄~청 묻이고 그다음 닦토를 해줘요 그러면 토너 양이 많아서 인지 자극을 조금 덜 받아요 닦토로 얼굴을 닦으면 노폐물 ㅋㅋㅋㅋ 엄청 잘나와요 세안하고 찝찝함을 달래주는 제품이에요 에스테틱에서 피부가 많이 예민하니 닦토는 절대 하지말라고 했는데 어쩌겠어요 ㅠㅠ 너무 찝찝한걸 ㅠㅠ 
 다른 친구는 얼굴이 뒤집어 지고 나서 어떤 제품을 사용해야할까 물어보길래 이 토너를 제일먼저 추천해줬어요 친구가 후기 남겨줬었는데 없어 졌네요 ㅠㅠㅠ",0.9794
1262,독도 토너 잘쓰고 있어요 몇통째 쓰고 있어요 닥토 할때도 좋고 용량이 많아서 더좋네용,0.0043
1263,"언제나 잘 쓰는 제품이에요. 대용량 쓰다보면 지겨워서 다른거 좋다는거 쓰다가도 다시 돌아오게 되네요. 저의 인생템!! 
 향은 은은하게 나고 바르면 금방 사라지고 닦토하고 더 덜어서 흡수 시켜주면 꿀 피부됨 ㅎㅎ 이 제품을 써야 트러블도 별로 안나더라구요.",0.179
1264,"요즘 독도토너 많이 사용하길래 구매해보았어요 세일기간에 구매해서 가격도 원가보다 저렴하게 구매했어요 
 저는 닥토로 사용할 목적으로 데리고 왔어요 향자체는 그냥 세지도 않고 그냥 쓸만 했던 것 같아요 용량도 작은게 아니고 대용량이라 부담가지지 않고 닥토에 딱 쓸만했었고, 순한 토너인거같아서 저에게도 잘 맞았어요 지성피부인 저에게도 산뜻하게 잘 사용할 수 있으면서 수분도 꽉 채워줄 수 있는 스킨이였어요 앞으로도 자주 닥토로 사용할 것 같더라구요. 건성이나 복합성인 분들도 부담스럽지 않게 잘 두루두루 잘 사용할 수 있을 것 같은 제품의 스킨이였어요",0.9764
1265,"완전 물토너로 촉촉하고 산뜻하니 좋아용ㅎㅎㅎ
 무엇보다 무향, 무색 이여서 부담 안가니 닦토로 잘 사용하고 있어요^.,^
 대용량이라 아낌 없이 아침, 저녁으로 팍팍 피부정돈 해주고 있답니당ㅎ.ㅎ
 재구매율100%",0.0047
1266,제 토너 정착템인데요 진짜 자극없고 순하고 약간의 각질제거도 있고 친구가 갑자기 좁쌀나고 마스크 때문에 피부가 안 좋아져서 추천 해 줬는데 너무 좋다고 피부 좋아진거 같다고 그만큼 여러 피부에 적합한거 같아요! 토너 뭐 살지 고민하시면 사세요!!!,0.2518
1267,건성 민감성에 굉장히 좋습니다 닥토보다는 팩으로 하기 굉장히좋아여,0.0032
1268,"항상 쓰는 제품이에요 떨어지면 쟁여놓는 인생 토너 자극 없이 순해서 좋고 여러번 덧바르기 너무 좋아요
 건성인데 닦토로 한번하고 물토 한번 이런식으로 합니다 사계절 가리지않고 써요 ㅎㅎ",0.0037
1269,기초 화장의 시작 토너의 중요성을 느낄수 있는 제품입니다. 요즘은 모든 제품이 기능성을 강조하다보니 기본이 약간 흐려진 제품도 있어서 살짝 아쉬운 제품도 있는데 이 제품은 기본이 탄탄한 것 같아서 좋은것 같아요.,0.0041
1270,뭘까요.. 그냥 닦토용으로 샀는데 처음 사용했을때는 정말 순해서 마음에 들었는데 이번에 이 토너 쓰고 피부 난리났어요.. 여드름 같은 붉은 뾰루지가 올라오고 처음에 이것땨문인지 몰랐었는데 딱 안쓰고 삼일 뒤 진정되어서 놀랐네요 재구매는 없을것 같아요,0.2284
1271,"독더 토너는 순하니
 좋네요
 발랐을때 물처럼 산뜻하고 끈적거림도 없어서 좋아요
 만족합니다",0.0042
1272,"정말 무난무난한 제품이에요 
 제형은 흐르는 물 제형이어서 진짜 얼굴에 물 바르는 느낌이에요 
 저는 가끔 닦토를 해주고요 평소에는 그냥 흡수시켜줍니다. 
 엄청난 뛰어난 효과를 보진 못했습니다",0.0498
1273,"대용량이 좋았고, 피부를 정돈하는데 딱 맞는 상품이고, 자극이 없어서 좋았다.",0.0035
1274,무난하고 좋아요 닦토로 쓰고요 각질제거에 좋아요,0.0032
1275,닦토하면 독토 토너죠 ㅎㅎㅎ 매우 순하고 대용량이라 막 쓰기 좋은가앝ㅇ으ㅛㅇ,0.0034
1276,꾸준히 사용하는 토너에요. 각질 제거 효과도 있어서 괜찮습니다.,0.0039
1277,"무난해서 잘쓰는거 같아요. 
 닦토, 3스킨으로 쓰고 있어요.",0.0035
1278,언니에게 사줬는데 건성인데도 촉촉하고 너무 좋다고 하네요.,0.0036
1279,닦토로 꾸준히 사용중. 대용량이라 쟁여두면 맘이 편함,0.0046
1280,"여드름피부딸이 잘써서 대용량으로 샀어요
 좋아해요",0.0039
1281,닥토할때나 팩트에 쓰는데 화장 엄청 잘먹어서 좋음,0.0037
1282,정말정말 순한 애국자 토너 인거같아영 너무좋아요 ㅎㅎ,0.0039
1283,"보습감있는 토너는 처음이에요
 자극없고 여드름 피부에도 잘맞아요
 대용량으로 재구매했어요~
 닦토 보습토너",0.0035
1284,가볍게 닦토로 좋습니다. 대용량이라 여러번 사용할 수 있어서 좋아요,0.0034
1285,좀 더 대용량으로 저렴하게 판매했으몀 좋겟어요!!!,0.0032
1286,"그냥 닦토로 쓰기에 무난한득??
 스킨 팩을 하거나 그런용도로 써보진 않아서 잘 모르겟어여",0.0039
1287,순하다고 해서 사봤어요 자극 없어서 쓰고 또 살듯,0.0029
1288,자극없이 순하고 좋아요 보습력도 너무 좋아요.,0.0035
1289,"흡수력도 좋고 피부트러블도 좀 있었는데
 조금이나마 진정된거 같아 꾸준히 쓰고 있어요ㅎㅎ",0.0036
1290,기본 토너로 쓰기좋네요. 민감피부인데도 자극없이 순해요. 바르고 나서도 촉촉한 편이구요.,0.0039
1291,딱 순하고 부담없는 느낌이에요. 세수하고 닦토 할때 부담없이 사용하고 있어요.,0.0045
1292,큰용량 보던중에 독더토너 한번 써봣는데 괜찮아서 이번에 샀는데 만족합니다,0.0039
1293,그냥 화장 전에 솜에다가 묻혀서 가끔 팩으로도 사용하고 그래요,0.0033
1294,용량도 크고 순해서 닦토로도 사용하고 흡토로도 사용해요!!,0.0032
1295,유명해서 한번 써보고 싶어서 샀는데 정말 좋네요^^,0.0035
1296,"양도 많고, 진정에 진짜 좋네요ㅎㅎ 
 얼굴에 붉은기가 많이 가라앉았어요ㅠ^ㅠ",0.0042
1297,닦토로 쓰고 있는데 용량이 많아 듬뿍 쓸 수 있어 좋습니다,0.0054
1298,자극 없이 순하고 좋아요. 진정하기 위해서 솜에 묻혀서 올려놓으니 좋네요,0.0044
1299,이젠 믿고쓰죠.. 갈질제거 순하게되네요 추천해요,0.0037
1300,믿고쓰는 독도토너 이제 그냥 고민없이 삽니다 ㅎ,0.0038
1301,보습에 참 좋은 것 같아요 자극 1도 없이 순한 느낌이 좋아서 아주 잘 쓰고 있습니다,0.0038
1302,매번 쓰던거라서 대용량으로 구매했어요 자극없이 좋아요,0.0036
1303,피부가 많이 예민한 편인데 순하고 자극도 없어서 너무 만족스렂게 쓰고 있습니다,0.0026
1304,양이 대용량이어서 막사용하기 좋고 자극없이 순해요,0.0048
1305,일단 양도 많고 가격도 착해요. 무엇보다 피부에 부담이 없어요,0.0037
1306,벌써 4통째 사용하고 있어요 저의 원픽 토너입니다,0.0044
1307,피부가 약한편이라 잘 맞지는 않네요ㅜ 소용량 하나 사용하고 다른걸로 바꿨어요,0.003
1308,가격도 저렴한데 성분도 착하고 대용량이라 좋아요,0.0034
1309,"친구꺼 사용해보고 구매했어요~~
 스킨팩하기도 좋아용",0.0049
1310,자극없이 순하고 좋아요 토너팩 하면 진정에도 도움되요!,0.0034
1311,닦토로도 사용 했고 물 제형이라 굉장히 좋았어요! 향은 많이 나지 않았습니다.,0.0041
1312,"순한거같은데 보습은 약한거같아요
 세일가격에 잘구입했어요",0.0036
1313,앞으로도 계속 꾸준히 사용할꺼에요 써본저픔중 최고랍니다,0.0034
1314,벌써 7개는 사용했어요 저렴하고 쓸수록 만족하고 있어요,0.0037
1315,항상 사용하던 거에요 딸들과 같이 사용합니다,0.0038
1316,양이 많고 피부에 순해서 쓰기 좋아요 착한가격에 사서 더 좋네요,0.0037
1317,독도 토너 잘 쓰는데 하도 펑펑 써대서 금방 사라지더라구요 좋아요,0.0039
1318,순하고 적당히 촉촉해서 닦토용으로 딱입니당ㅎㅎ,0.0038
1319,순해요 물 같아서 어떤 피부에 사용해도 괜찮을 것 같아요ㅔ,0.0039
1320,계속 쓰는 제품이라 할인할 때 샀어요~~~~~~,0.0034
1321,"순하고 잘지워져서 좋아요
 다음에 또 구매 예정",0.0031
1322,독도 시리즈는 다 좋은 것 같아요 순하고~ 용량도 많습니다,0.0058
1323,그냥 토너 쓸거 없어서 좋다길래 삼. 딱히 막 좋다는건 못 느끼겠음.,0.0035
1324,성분이 순해서 이 제품을 주로 발라주고 있어요,0.0028
1325,"세일할때 사봤는데,, 가격대비 만족합니다..^^",0.0036
1326,빨리 쓰긴 하지만 자극 없고 만족하며 쓰고 있습니당 !,0.0038
1327,자극 없이 순하고 무겁지 않은 제형이에요 각질 제거에 도움이 많이 되는거 같아요,0.0031
1328,유명ㅎㅐ서 사봤는데 쏘쏘 나쁘지 않아요 닦토용 추천,0.0042
1329,사람들이 워낙 좋다고해서 써봤는데 좋네요 두번째 구매합니다,0.0033
1330,"뭐 독도는 다들 알다싶이 너무 좋아요
 몇통째 쓰는지 모르겠어요",0.0042
1331,"믿고쓰는 제품입니다
 건성한테 좋아요 ㅎㅎ 닦토로 사용중이에요",0.0046
1332,지성피부에 산뜻하니 좋은거 같아요. 맑은 타입으로 순하네요,0.003
1333,왜인지는 모르겠지만 그냥 요거만 쓰게되네용 ㅋ ㅋ,0.0047
1334,닦토용으로 사용중인데 자극 없이 순하고 좋아요!,0.0033
1335,세안 후 닦토로 사용해요 자극없이 순해서 사용하기 좋아요,0.0044
1336,독도클렌저랑 같이 쓰면 시너지가 좋은 것 같아요.,0.0041
1337,원래 쓰던 토너 쓰다가 바꾸ㅏ봤는데 역시 유명한 이유가...크...!!,0.0046
1338,양이 너무 많아서 아직도 사용중에예요! 닥토하는데 사용감도 좋고 보습감도 좋아요,0.0039
1339,"추천받아 구매했는데 진짜 좋아요
 순해서 정말 만족하며 사용하고 있어요",0.0041
1340,자극없이순하고 세안후 토너로 피붓결 정리할때 가성비갑인 토너입니당ㅎㅎ,0.0037
1341,독도토너 유명해서 사용해봤는데 무난하고 좋아요,0.0029
1342,완전순해요 트러블안나고 각질제거는 잘 모르겠지만 잘 되는거겠죠 뭐가 안나니..,0.0042
1343,제일 기본템에 순한 느낌이라 쓸 때 안심하고 쓸 수 있어요,0.0032
1344,각질제거기능도 있다고해서 구입했어요.화장솜에.듬뿍 묻혀서 닦토합니다.,0.0039
1345,딱봐도 순해보이는 토너에요 닦토로 무난하게 쓰고 있어요,0.0051
1346,필요없는 각질만 제거하고 수분감이 있어 데일리로 쓰기 좋네요,0.0045
1347,양도 대용량이고 물토너인데 피부가 촉촉해지고 피부결도 좋아지는걸 느껴요!,0.003
1348,화장솜에 묻혀서 피부결에 따라 피부정돈을 하는데 자극 없이 순하고 좋아요,0.0041
1349,매번 재구매하는 제품입니다. 대용랴이라서 막 바르기 좋아요,0.0039
1350,"피부가 예민한 편인데, 자극없이 순해서 좋아요",0.0046
1351,"사용감이 좋아서 자주 사용하는 아이템 이녀요
 가격대비 좋아요",0.0037
1352,향이없어서 낯설었는데 그만큼 순하고 피부도 깨끗해지는거같아요,0.0044
1353,호불호 없어서 좋아요 막쓰기에도 좋습니다 :),0.0038
1354,독도 토너는 말해 뭐합니까^^ 그냥 추천이에요~ 너무 좋아요! 정착템!,0.0034
1355,정말 자극 전혀 없어서 무난하게 쓰는 토너에요,0.0043
1356,독도토너쓴이후로다른제품못쓰겟더라거요 좋습니다.,0.0034
1357,"계속 쓰고 있는 무난템이에요
 향도 없고 순하게 각질제거 되는 느낌이라 추천드랴용!!",0.0045
1358,자극없이 촉촉하게 스킨케어할수있어서 너무 좋아요,0.0034
1359,스킨좋아요 수분충전용이며 향은 그저그래요! 제형은 묽어요,0.0034
1360,저는 트러블이 많은 편인데 저녁에 스킨팩 해주면 진정되고 좋아요 양이 많ㅇㅏ서 좋습니다,0.0045
1361,좋아요~~~향은 딱 쓰기좋아요 배송도빠르고 얼굴에도 잘맞구 계속쓰고 있는데 좋아요,0.0036
1362,"진짜 너무 좋아요
 재구매의사완전있어요
 사계절용입니다!",0.0044
1363,가성비가 너무 좋아서 항상 쟁여두는 아이템입니다 :-),0.0047
1364,촉촉하고 순하고 좋네요. 용량도 짐승이라 너무 좋아요ㅎㅎ,0.004
1365,자극도 안느껴지고 닦토로 쓰기에도 7스킨법하기에도 좋아요,0.0029
1366,물같은 제형으로 굉장히 순하고 패드를 순한걸 잘 쓰면은 촉촉하니 좋은 것 같습니다,0.0042
1367,"몇년 째 사용하는 제품으로 순하고 트러블 없이 무난하게 사용할 수있는 제품입니다
 묽은 토너 순한 토너 깔끔 토너",0.004
1368,직원이 추천해줘서 써본 뒤로 몇통째 구입했어요 ㅎㅎ,0.0039
1369,그냥 무난하게 닦토로 쓰려고 구매했어요ㅎㅎ 자극도 없고 괜찮아요,0.0058
1370,향은 거의 없고 순해요 닦토로 좋아요 양도 넉넉해서 좋네요,0.0039
1371,일단 처음 써봤는데 자극없이 순한 것 같아요~,0.0038
1372,저는 별로였음 다시 안 살듯 ㅎㅎㅎ 원래 쓰던거로갈래요,0.0027
1373,"아이쓰라구 사줫어요
 
 일단 순한거같아요~~~ 대용량이라 부담엊ㅅ어요",0.004
1374,동생이 쓰고 싶다고 해서 사줬는데 잘 쓰고있네요,0.0032
1375,"순하고 끈적이지 않아서 무엇보다 좋아요
 무난하고 성분이 착해요",0.0044
1376,"선물용으로 샀는데 좋네요!
 다음에도 또 구매할까 고려중입니다",0.0038
1377,향도 무향이고 순해서 민감피부에 쓰기 좋은거갗아요,0.0039
1378,저는 여드름이 많이나는 피부인데 자극없고 압출후 화장솜에 적셔 올려놔도좋아요,0.0046
1379,자극없이 순하고 좀 각질ㅈㅔ거가 되는 느낌이 있어요 좋아서 재구매했어요,0.0036
1380,순하고 향도 괜찮고 다시 재구매할거같습니다~~,0.0035
1381,"데일리로 쓰기 좋은 제품이예요
 생각했던 찰랑찰랑하는 물제형은 아니였지만 괜찮았어요",0.0037
1382,토너를 안써보다가 유명하다길래 한번 사봤는데 각질제거도 되고 너무 좋아요,0.0044
1383,주위에서 추천받아서 쓴 제품인데 정말 순하고 좋아요!,0.0036
1384,"세일할때 대용량으로 처음으로 구매해봤는데
 다음에도 또 구매할 의사있어요",0.0041
1385,"자극없이 순해요
 대용량이라서 좋고 닦토로 사용합니당",0.0044
1386,용량 맘에 듭니다..향은 은은하고 끈적임 없으니 잘 쓰겠습니다,0.0032
1387,"솔직히 정말 무난하고 괜찮다고느껴요 ㅎㅎ
 그래서 자주사용함",0.0041
1388,벌써 세 통 넘게 쓰고 있어요 크게 트러블 나지 않고 순해요,0.0038
1389,"피부가 예민한데...
 정말로 순하고
 용량도 크고 만족입니다",0.0045
1390,좋아요 순해서 추천이 많아서 구입했는데 괜찮더라구요2,0.0038
1391,"수부지고 여드름, 뾰루지 잘 올라오는 피부라서 닦토하는데 진짜 순하고 좋아여",0.0041
1392,냄새도 없고 제피부가 수부지인데 건조하지 않고 좋아요,0.0045
1393,싸고 양도 많고 좋아요. 엄청좋은점을꼽을있기보단무던함,0.0028
1394,건성에 좄아요. 세안 후 화장솜으로 닼아서 쓰기 좋아요,0.0036
1395,토너팩이나 가볍게 닦는 용도로 쓰기 아주 무난해요,0.0032
1396,꾸준히 사용하고 있는 제품. 피부결 정돈이나 진정용으로 잘 사용하고 있음,0.0049
1397,처음써보는데 보습도 괜찮고 피부결이 정리되는 느낌이라 좋습니다,0.0033
1398,고등 딸애가 최애하는 제품. 대용량이라 화장솜에 충분히 적셔서 사용해도 부담이 적어요^^,0.0036
1399,세안후 가볍게 토너해주면 노폐물제거도 좋고 자극없이 순한편이라 깨끗해지는 기분이예요,0.003
1400,대용량이라서 좋아요 자극적이지 않고 넘 좋아요,0.003
1401,"작은거 사서 써보고 대용량으로 구입했습니당
 순해서 손이 가게되는 제품이었어요",0.0041
1402,감사히 잘받았습니다. 좋은 토너예요 !! 잘쓸게오,0.0039
1403,닦토로 쓰고 있는데 향도 피부느낌도 자극적이지도 않고 좋아요!,0.0044
1404,퓨어한 느낌의 토너에요. 잘 닦이는거 같고 보습까지도 가능한거 같아요,0.0042
1405,대용량이라서 오래 사용 가능하고 순하고 좋네요 보습에도 괜찮은것 같아요,0.0038
1406,자극 없이 순하고 지성인데 유분도 없고 딱 닦토하기 좋아요,0.003
1407,워낙 유명한 제품이었지만 이번에 처음 사용해봤습니다 자극없이 순합니다,0.0028
1408,한번 써보고 괜찮아러 계속 이용중입니다ㅎ 좋은 제품,0.0035
1409,"세안 후 닦토로 사용하고 있는데, 수분감이 많이 느껴지고 깔끔합니다.",0.003
1410,10대부터 쓰기 좋은 순한화장품! 몇통째입니다!!,0.0032
1411,"건성에 좋고 보습에도 너무 좋아서 좋아요
 특히 자극없이 순해서 좋구요",0.0047
1412,독도토너 작은거 써봤는데 괜찮아서 대용량으로 샀어요~,0.0043
1413,닦토용으로 매번 쓰는 상품! 독도토너로 닦고나면 얼굴이 부드러워 지는 느낌.,0.0044
1414,할인행사 하면서 저렴한 가격에 잘구매 했네요.,0.005
1415,"별말 안해도 이제 다아는 독토!
 이름부터 감동이지만
 제품도 감동",0.0038
1416,정말 순한거 같긴하네요. 자극적이지 않아서 계속 쓸거같아요.,0.0039
1417,"토너 로션 세트로 구매했는데, 양도 대용량이구 만족해요ㅎㅎ",0.0033
1418,좋다는 소문듣고 구매하게 되었어요. 용량도 크고 막사용하기 좋아요.,0.005
1419,피부결 정돈할때 사용해요. 자극도 덜하고 좋아요.,0.0042
1420,대용량으로 항상 구비해두고있어요~ 무난하게 쓰기좋엉ㅅ,0.0029
1421,피부 예민한테 잘 쓰고 있어서 재구매했어요 너무 좋아요,0.0041
1422,순해서 쓰기 좋아요 자극도 없고. 몇 통째 쓰는 중입니당,0.0036
1423,"지금 닦토로 사용 중인데, 너무 만족스러워요~!",0.003
1424,순하고 좋아요. 다른 독도 라인들과 함께 쓰니 좋네요,0.0031
1425,진짜 순한 닦토로 짱입니다!!!!!!!!! 너무 물같아서 솜을 이용해서 사용해야합니당~!,0.004
1426,화장전 스킨케어로 딱이에요!!!바르고나면 깔끔해서 너무좋아요!!!,0.0048
1427,토너는 항상 이것만 써요... 눈에 들어가도 쓰리지 않아요,0.004
1428,"지속적으로 재구매하여 사용하고 있는 토너입니다,순해요!!!",0.0043
1429,딱토에 최고인거같아영 양도 많아서 좋아여 !!,0.0044
1430,"항상 사용하던 제품 좋아요
 성능굿
 사용감굿
 만족",0.0047
1431,촉촉하고 뾰루지도 조금씩 들어가는 것 같아서 좋아요!!!,0.0041
1432,"닦토, 스킨팩으로 모두 사용하기 좋아요ㅎㅎ 용량도 적당하고 자극도 없이 순해요",0.0053
1433,계속 사용중인 믿고쓰는 독도토너지요ㅎㅎ 만족합니더,0.0043
1434,세일할때마다 쟁여두는 제품입니다. 자극없이 순하고 좋아요~!,0.0037
1435,자극없이 순하고 닦토하기도 좋은 인생스킨입니다!!,0.0033
1436,순하고 자극없어서 너무 편하게 꾸준히 사용중입니다,0.0045
1437,사실 그렇게 좋은지는 모르겠어요 ㅠㅠ 여드름 피부에게 말이죠,0.0056
1438,그냥 물같고 좋아요 인생템~~~ 냄새도 없어서 좋음,0.0042
1439,좋아요 안당기고 촉촉해요 좋아요 좋아좋아좋아요,0.0034
1440,순하고 좋아요 닦토로 사용하는 게 가장 좋은 것 같아요 무향이에요,0.004
1441,세안후 화장솜에 적셔사용하는데 촉촉하니 좋아요~~,0.0043
1442,복합성인데 촉촉하고 산뜻해요 여름에 쓰기 좋아요,0.0041
1443,순하고 편하게 쓰기 좋은 토너에요 토너팩으로 딱입니다,0.0043
1444,좋음... 엄청 좋은건 모르겠지만 그냥 괜찮음,0.003
1445,자극없이 순하고 닦토하기도 좋은 인생스킨입니다!!,0.0042
1446,순하고 자극없어서 너무 편하게 꾸준히 사용중입니다,0.0037
1447,사실 그렇게 좋은지는 모르겠어요 ㅠㅠ 여드름 피부에게 말이죠,0.004
1448,그냥 물같고 좋아요 인생템~~~ 냄새도 없어서 좋음,0.0042
1449,좋아요 안당기고 촉촉해요 좋아요 좋아좋아좋아요,0.0033
1450,순하고 좋아요 닦토로 사용하는 게 가장 좋은 것 같아요 무향이에요,0.0032
1451,세안후 화장솜에 적셔사용하는데 촉촉하니 좋아요~~,0.0037
1452,복합성인데 촉촉하고 산뜻해요 여름에 쓰기 좋아요,0.003
1453,순하고 편하게 쓰기 좋은 토너에요 토너팩으로 딱입니다,0.0029
1454,좋음... 엄청 좋은건 모르겠지만 그냥 괜찮음,0.0036
1455,토너로 사용하기에 적당합니다. 세일할 때 잘 구매했습니다,0.0041
1456,독도 토너가 유명하다고해서 구입했는데 자극없이 순하게 사용가능해요~,0.0034
1457,민감성피부인데 자극없이 잘사용합니다. 좋아요~~,0.0038
1458,"예민한 피부에도 자극없이 순해요! 다른 토너 사용하면 땡긴적이
 많은데 보습력도 괜찮았어요",0.0051
1459,저번에 써보고 맘에듳어서 대용량으로 주문했어요! 자극없눈거같아서 제일좋아요,0.0032
1460,"자극, 향이 없어서 좋아요. 양도 많고 꾸준히 쓰기에 딱 좋아요.",0.0043
1461,저렴한 가격에 너무 잘써서 다른거랑 혼합해서 너무 잘쓰고 있어요~,0.0038
1462,주변 지인들의 추천으로 구매했어요. 양이 진짜 많아요. 닦토용으로 강력 추천합니다.,0.0033
1463,진짜 이제 이것만 평생쓸려고요 세일많이 해주세요 젭발루....,0.0037
1464,"자극없이 순해서 무난하게 쓰기 좋아요!
 복합성에 추천합니당",0.0028
1465,순한 토너 중에 최고 닦토 흡토 다 좋아요 첫두번이나 싰느네요,0.004
1466,닥토가 다 떨어져서 이번에 구입했는데 사용하기 좋아요,0.0057
1467,"독도토너보다 좋은거 없음 
 5통째 사용중 찐리뷰후기",0.0039
1468,아직 사용해보진 않았지만 넉넉해서 부담없이 막쓰기 좋을거 같아요~,0.004
1469,"마구마구 쓰기 좋은 대용량이라 좋아요
 근데 너무 가벼워서 가을겨울은 건조해요",0.0032
1470,몇 년째 독도라인만 쓰고 있어요 순하고 좋아요 추천합니당,0.0038
1471,항상 애용하는 제품입니다~ 순하고 데일리로 좋아요~,0.004
1472,"자극이 없어서 좋고 대용량이라 넉넉하게 바르기
 젛았습니다",0.0039
1473,작은 용량 쓰다가 좋아서 대용량으로 구입했어요 자극없이 순해서 좋습니다,0.0032
1474,스테디셀러인만큼 훌륭한 것 같습니다. 재구매 의사 있습니다!,0.0052
1475,워낙 유명해서 구매해봐요 잘 맞았으면 좋겠네요,0.0032
1476,"좋지도 않고 나쁘지도 않은 제품
 나쁘지 않아서 써요",0.0036
1477,"항상 이용하는제품이예요
 앞으로도 계속 사용할 계획입니다",0.0035
1478,지성이거 피부가 예민한데 진정에도 좋고 자극없이 넘 순해요,0.0041
1479,좋은제품 싸게 잘샀습니다 너무 좋아요 배송도 빨라요,0.0038
1480,무색무취에 슴슴하니 순해서 좋네요! 오래쓰겟어요,0.0038
1481,"순하네요
 워낙 유명해서 기대했었는데
 보습도 좋은것 같아요",0.0048
1482,사용하기에 좋은 제품은 입니다 제가 ~~!!!~,0.0041
1483,요즘 핫한 독도 토너 함 사봤는ㄷㅔ 순하거 피부에 무리없음,0.0033
1484,친구한테 선물했는데 좋아하네요 양도 많고 좋습니다,0.0039
1485,물같은 제형이고 끈적임없이 닦토로 사용하기 좋아요.,0.0034
1486,좋아요 ~~~~~~ 어성초토너 쓰다가 갈아탔어요,0.0044
