,review,yuyong
1082,"좋은데는 이유가 있습니당
 피부타입
 지성에 좋아요
 피부고민
 보습에 좋아요
 자극도
 자극없이 순해요
 역시 좋다고하는데는 이유가 다 있어용 
 
 @좋은점
 일반적인 토너, 스킨과 다르게 점액있는 묽음이라서 신기했어요~ 오히려 이런 부분 덕에 수분감이 더 크게 닿는 느낌이었어요. 시원해서 여름에 사용하면 좋을 거 같아요~ 다음에는 로션과 크림도 써보려고요!
 
 @아쉬운점
 없다. 너무 없다. 짱짱",0.9809
1083,"데일리 각질토너로 유명해서, 전에도 한번 써봤는데 괜찮았어서 요번엔 대용량으로 구매했어요. 타 로드샵에서는 100미리 더주던데ㅋㅋㅋ 쿠폰 있길래 그냥 샀어요. 
 이토너는 각질토너라 하는데, 각질을 확 없애주는건 아니에요. 매일 써도 자극이 없을정도로 순해요. 피부 타입별로 다르겠지만 뾰루지도 잘나고 하는 피부인데 괜찮았어요.
 순한 닦토 찾으시면 써봐도 좋을 제품입니다",0.5655
1084,항상 구매해서 사용하는 독도 토너 ! 독도 로션과 같이 몇년째 꾸준히 사용중이에요. 항상 특별히 모난 것 없이 무던하게 사용하기 좋아서 쭉 쓰는 중인데 ㅇㅖ전에 비해서 할인 행사나 증정 행사를 많이 하는 편이라 더 좋아요 ㅎㅎ 아무래도 매일 사용하는 제품이다 보니 가격대가 그렇게 리즈너블하다고 할 수는 없지만 탈 없이 다른 제품 고를 필요없이 쭈욱 이 제품만 쓰는 저로서는 오히려 허튼 돈 쓰지 않고 쓸 수 있어서 좋습니당 ㅎㅎ 잦은 리뉴얼이나 큰 이슈가 없다면 앞으로도 쭉쭉 사용할 제품이라서 매번 구매할 때 쟁여 놓고 사용 중이에요 ! 처음엔 물 같은 타입이라 이게 피부에 어떤 작용을 하긴할까?했는데 막상 사용하다보면 저한테는 이만한 제품은 없는 것 같아요 ㅎㅎ 앞으로도 쭉 사용하고 싶은 인생템이에요 !! 잘 사용하겠습니다 ㅎㅎ,0.9666
1085,"제 피부는 우선 엄청난 지성에 여드름을 달고 사는 사람입니다. 그런데 우연히 오빠가 독도 스킨을 쓰고 피부가 말랑 매끈해진 걸 보고 저도 후다닥 달려가서 샀습니다.
 
 거두절미하고 장점을 말씀드리자면
 1. 대용량이다 : 요근래 본 스킨들은 다 쬐깐해서 화장솜이랑 같이 적셔서 쓰면 뻥 안치고 한 일주일이면 반 밖에 안 남던데 독도 스킨은 대용량이라 맘 편하게 쓰고 있습니다.
 
 2. 순하다 = 물같다 : 그냥 물 같아요. 점성도 끈적이는 것도 없이 그냥 얼굴에 물을 적시는 듯해서 순합니다.
 
 3. 취지가 좋다 : 이 제품을 사용하고 독도의 날과 독도에 대해 더 많이 관심을 가진 것 같습니다. 고맙습니다.
 
 단점이라고 하면, 너무 순해서 사실 효과가 있나 없나 하실분들도 있을 것 같습니다. 그래도 안 바르는 것 보다는 훨씬 나아서 사용하고 있습니다. 순해서 그냥 얼굴 마르지 않게 바르는 거라 생각하고 추가적으로 기능성 화장품을 첨가하면 더 좋을거라 생각합니다.",0.9662
1086,"닦토로 가볍게 사용하기 좋은 것 같아요
 자극없이 스킨케어하기 좋아요",0.0039
1087,"닦토+팩용으로 사용 할려고 쓰던거 재구매 했어요!!
 여름에는 독도가 최고:)",0.0037
1088,"저는 써봤던 토너중에 독도가 제일 좋은거같아요
 적당히 보습진정되고 순해서 무난하게 사용가능한거같아서
 만족합니다!",0.0046
1089,"원래 세이어스 제품을 쓰다가 국내에 안들어오기도 하고, 아무리 토너라고 해도 진정과 보습효과가 있는 제품을 쓰고 싶어 구매했습니다. 워낙 유명한 제품이라 기대도 했는데 기대만큼 순하고 진정보습에 효과가 좋은 것 같아요! 여드름피부에다가 여름에는 얼굴로 열도 몰려서 트러블이 심한데 3일 정도 사용해보니 진정에도 확실히 효과가 있는 듯 합니다. 많이 가라앉았아요ㅎㅎ 기존에 사용하던 제품은 물의 제형에 가까워서 1차클렌징할 때도 쓰고 아침에 닦토와 스킨팩에 다 썼거든요. 이 제품은 물 제형보다 에센스에 가깝다보니 아까워서 막쓰지는 못하는 중입니다ㅎㅎㅎ 향이 거의 없는 편이고 투명한 타입이에요. 트러블피부인지라 화장품 고를 때 무조건 성분부터 보는데 유해성분 하나도 없어서 안심하고 사용합니다! 가격이 조금 있다는 게 흠인 것 같아서ㅠ 세일할 때 쟁여야겠어요. 추천합니다!",0.9744
1090,여름이라 무거운 토너대신 가벼운 토너가 필요해서 삿어요~ 성분도 좋고 가격도 착해서 재구매 의사 있어용,0.0047
1091,"독도토너! 말해뭐해 최강 토너,, 저는 수부지+속건조 피부입니다 그래서 촉촉하면서 유분끼는 전혀 없어야 하는 스킨케어를 좋아해요!! 루틴은 스킨/토너(스킨팩/토너패드)-에센스(세럼)-수분크림 입니다! 점성이 있는 토너보다는 물같은 토너를 선호하고 무향을 좋아하는데 독토토너가 딱 모든 기준을 충족했어요,, 
 물처럼 흘러서 닦토하기 너무 좋아요! 저는 아침에는 토너패드를 사용하고 저녁에 이 토너를 사용하는데, 토너패드를 다 사용했을 때에는 독토토너로 스킨팩을 해줘도 정말 좋아요!! 
 개인적으로,, 수부지에게 추천드립니다 혹은 복합성!!",0.974
1092,항상 쓰는 토너에요! 자극없이 순하고 깔끔하게 닦이고 피부결이 정리 되서 잘 쓰고 있어요 벌써 몇통째쓰고 있어요 ㅎㅎ,0.0028
1093,"독도토너는 워낙 순~~하기로 소문 자자한 상품이기 때문에 다 쓰면 사고, 부족하면 사고 하는 아주 좋은 토너인 것 같네요ㅎㅎ 근데 그냥 순함 그 자체라서 특정 효과를 원해서 구매하는 상품은 아니구요 딱 닦토로만 사용하는 토너에요! 그래서 그런지 더힐나위없이 딱 기능에 맞는 코너인 것 같아요! 가격대가 많이 비싼 것도 아니라서 사용하는데 있어 아낌없이 사용할 수 있고, 매우 순하기 때문에 피부에 자극도 안가고, 그렇기 때문에 다음 스킨을 피부에 흡수하는데 방해하지 않고 도움을 주는 것 같아여! 앞으로 계속 사용할 토너이기 때문에 별점 5개 남기고 떠납니당ㅎㅎ홍홍",0.9745
1094,"라운드랩 독도 토너 유명한 거 모르는 사람
 아마 대한민국에 없을 정도로 엄청 유명템이자나요!
 그래서 저도 한번 써보려구 사봤어요~
 
 토너 말구 라운드랩 껄로 독도 라인 중에
 무기자차 선크림 쓰고 있는데
 이것도 진짜 완전 꿀템이거든요~!
 무기자차임에도 불구하고 향도 나쁘지 않고
 발림성도 좋았던 기억이♡
 
 그래서 이 브랜드에 대한 믿음이 탄탄하게 생긴 상태여가지구
 독도 토너 워낙 유명하니까 한번 써보려고 샀어요!
 
 무향인 것도 완전 맘에 들고
 무엇보다 성분이ㅠㅠㅠ 넘넘 좋습니다!
 걍.. 물은 아니겠죵?ㅋㅋㅋ 이렇게 순하다니~
 자극 없는 거야 당연하고 피부도 진정되는 느낌입니다!",0.9328
1095,독도토너 사용하다가 다 써서 이번에는 대용량으로 구매했습니다. 물제형이라서 닦토하거나 스킨팩하기에 좋습니다. 대용량이라서 걱정없이 많이 쓰고 있습니다. 사용감은 촉촉하게 흡수되면서 산뜻해져서 복합성인 분들이 쓰시기에 좋을 것 같습니다. 순하기 때문에 민감성인 분들도 사용하기에 적합할 것 같습니다. 증정으로 준 100ml 토너도 너무 귀엽고 여행갈 때 챙겨가기에 좋을 것 같습니다. 독도토너는 독도로션과 함께 사계절 내내 사용하기에 알맞고 겨울에는 독도크림이랑 같이 쓰면 좋습니다. 세일하고 증정품 줄때 맞춰 한번 사용해보세요! 추천드립니다~!,0.4734
1096,"토너 제품은 이 제품 아니면 사용을 못할 정도로 저같이 피부가 민감한 분들한테 너무 순한 성분들로 이루어져있습니다!!!
 너무 순해서 자극이 없어서 많이 사용하다보니깐 금방 다시 사야되는데 조절해서 사용하면 진짜 가성비 갑인 제품이라고 생각합니다!!! 
 할인 할 때마다 사놓고 사용하는 편입니다!!!
 그리고 토너 제품 중에서는 개인적으로 가장 순하다고 생각하고 피부진정 및 보습에도 효과적인 제품이라고 생각합니다!!!
 이 제품 때문인지는 모르겠는데 피부가 안좋아진 후에 이 제품으로 바꿨는데 피부가 많이 개선되었습니다!!!
 피부가 고민인데 토너 바꾸고 싶으신 분들에게 추천하는 제품입니다!!!",0.9738
1097,제 화장대엔 언제나 독도 토너 떨어지면 불안해서 세일때 쟁여둬요 피부결이 맨들맨들 좋아지는것 같고 여드름 있는 우리딸도 이제 같이 쓰기시작했답니다~~,0.0054
1098,"일단 저는 건성, 민감성 피부인데 예전부터 올리브영에서 독도 라인 판매하는거 보고 궁금했는데 이번에 구매 했습니다~~
 저번에 친구꺼 잠깐 써보고 건조해서 안 맞구나 하고 넘겼는데 주변에서 독도라인이 그렇게 순하다고 해서 구매해보았는데요 ~!!!
 일단 물 토너라서 흡수 시키기 정말 좋았어요 ~
 지성 건성 복합성 모두 수분이 정말 중요하다고 들었습니다₩~
 안 그래도 마스크때문에 얼굴이 민감하고 푸석해졌는데 이번에 물토너 독도 3스킨 활용해서 수분 채워줘 보려구요 ~~
 세일 안 하면 스킨 사용하는 용량에 비해 비싸다고 생각했는데 세일 할 때 사면 살만하ㄴ거 같아요 ~",0.9828
1099,"독도 토너는 그냥 무난하게 바르기 좋은 제품이에요. 막 촉촉하게 보습이 된다기 보다는 밤에 세안하고 피부를 닦아내기 좋은 토너 인거 같아요. 
 
 건성 피부로써 닥터지.마몽드.싸이닉.라로슈포제 등등 좋다는 건 다 써봤는데 제 기준 피부에 수분을 채워준다는 느낌이 든건 닥터지.라로슈포제 인거 같아요. 
 
 전 봄가을겨울에는 닦토 하고 나서 손에 묻혀 두세번 덧발라주는데 독도 토너는 몇번 레이어드해서 토너로 흡수 시키기에는 아쉬웠어요.
 
 그리고 이 토너는 무난하게 사계절 내내 사용하기에 좋은 거 같아요.",0.9781
1100,제형은 완전 그냥 물입니다 . 화장솜에 덜어 토너처럼 사용하였구요 세수하고나서 급하게 수분충전용으로도 딱이에요! 그리고 향은 딱히 없는것같아요! 그리고 이마에.좁쌀여드름이 갖자기 막.올라왔던 기간이있엇는데. 독도토너 한달넘게.쓰다보니 언젠가부터 좁쌀도 다.들어가더라고요 토너를.처음써봐서 토너의.기능인지는.모르겠지만 만족해요 피부결도 왠지 부드러워진것같아요 ㅎㅎ 아!!! 그리고 제가 지성이.되게.심해서 코에 화이트헤드가 2일 3일만 지나도 바로 생기는데.이거 쓰고나서 화이트헤드가 잘.안생겨서 진짜.신기하고 너무 좋더라고요!!!,0.9786
1101,"화해 어플에 올라온거 대부분 써봤는데
 독도토너가 제일 좋더라고요
 쟁여두고 막 씁니다
 토너로 닦고 진정용으로 올려두고요",0.0054
1102,이거 진짜 몇 통째 쓰는지 모르겠어요.. 자극 없이 순하고 깔끔해서 독도에 정착했어용! 큰 장점이나 단점 없이 무난하게 사용하기 좋아요👍 지성이나 복합성 타입한테는 딱 적당한 보습감도 줍니당! 추천드려요~,0.3615
1103,제가 좋아하는 토너에요 다른 토너들은 뭔가 강한 거 같은데 이 토나는 순하고 좋아요 거기다가 대용량이길래 바로 샀어요 토너를 사용할 때 그냥 사용하는게 아니라 팩처럼 피부에 좀 올려놨다가 사용하거든요 그럴때 양이 적으면 금방쓰는데 양많아서 다른 토너에 비해 오래 사용할 거 같아요 진짜 순해요‼️ 왜 화해 어플에서 1등한 건지 알 정도로 진짜 좋아요 독도꺼는 진짜 좋은 거 같아요 다른 분들도 닦토해도 좋을 거 같아요 ㅎㅎ 제형은 물제형이에요‼️ 지금은 로션도 사용하고 있는데 아주 좋아요 저는 이제 토너를 독도꺼만 쓰려고요 다른 분들도 사용해보세요,0.5229
1104,"닦토용도로 구매했고
 좁쌀에 좋다고해서 구매했어요!
 
 엄청 큰 효과는 없지만
 세안후 닦아내기에 딱 좋은 제형이라
 만족하면서 쓰고있습니다
 
 용량도 대용량이라 팍팍쓰기좋지만
 건성인 제 피부에 보습효과는 기대하기 힘들었어요
 이제 가을지나면 곧 겨울인데
 보습력이 떨어져서 겨울엔 쓰기 힘들것같습니다ㅠㅠ",0.2525
1105,그 전에 사용하던 시*토너 쓰다가 피부 뒤집어져서 ㅠㅠ독도로 갈아탔는데 한달 사용해봐야 알 것 같네요 민감성지성인데 피부 자극없이 순했어요,0.0051
1106,"늘쓰던거에요 복합성피부인데 유수분조절에 좋은것같아요 스킨바꾸고나서 좁쌀여드름박멸에 도움이 됬어요
 순하고 유해성분없이 편안했어요",0.0035
1107,"처음 사용 두달까진 자극이나 트러블 없이 사용했음
 원래 아*아 스킨 사용했는데 갈아타도 문제없겠다 생각했을정도 기존 아*아 스킨의 경우 좁쌀은 막아주는데 화농성이 한번씩 올라와서 스킨 갈았었고. 독도 제품은 2달까진 트러블, 좁쌀, 화농성 다 그리 크게 올라오지않았었음
 하지만 장시간 마스크 착용+생리기간이 겹치면서 걷잡을 수 없게 좁쌀, 트러블, 화농성 올라오기 시작
 로션때문인가 썬크림 때문인가 하나씩 안써봐도 똑같아 미칠노릇
 병원가서 약받아먹어도 나아지지 않음
 스킨이 원인인거 같아 다시 아*아 스킨쓰는 순간 그 다음날 아침 피부 가라앉음
 지금 독도에서 다시 원래쓰던 스킨으로 돌아왔는데 피부트러블, 좁쌀 싹 사라짐ㅜㅜ
 독도 스킨은 다신 안 쓸 예정 ㅠㅜ
 잠시좋았음",0.9784
1108,지성이라서 무거운 제형은 선호하지 않는데 독도토너는 물같은 제형이라서 너무 맘에 들어요. 그리고 제형이 너무 가벼우면 보습감이 없을까봐 걱정했는데 충분히 촉촉하고 산뜻해요. 수부지한테 딱!!!,0.9434
1109,"독도토너가 그렇게 좋다고 하길래 구매했는데 사실 제 피부에선 좀 건조한 느낌이었어요.
 
 저는 수부지인데 평소에 가벼운 토너 사용하고도 세럼과 크림을 발라주니까 괜찮았는데
 귀찮은 날엔 토너만 바를 때가 있어요.
 
 근데 독토 토너는... 재구매 의사 없어요",0.0044
1110,"저는 각질패드를 사용하고 남은 빈 통에 티슈타입 화장솜을 넣고 독도토너를 듬뿍 적셔서 사용하고 있습니다.
 토너도 각질제거에 도움이 되고 화장솜도 미세 홀이 있는 제품을 쓰고 있어서 필링을 따로 쓰지 않아도 데일리로 케어할 수 있어서 좋습니다.
 독도토너는 성분이 순하고 자극이 적어서 앞으로도 무난하게 계속 사용할 수 있는 제품인 것 같습니다. 이것저것 사용해보다가도 결국 손이 가는건 이런 제품이더라고요.
 독도토너 라운드랩 대용량",0.1895
1111,"닦토로 사용하기 정말 제품이에요!!!! 가격도 좋아서 꾸준히 쓰고 있는 토너입니다 대용량이라 양도 많아서 너무 좋아요 거기다 성분도 좋아 대만족입니다!!!!! 
 가성비 좋은 토너를 찾으시는 분들은 이거 무조건 사용하세요!!!!!",0.0034
1112,그냥 물같지만 효과는 좋은 토너입니다!! 한 번에 효과가 보이는건 아니지만 꾸준히 쓰다보면 피지와 각질이 올라오는게 줄어드는게 느껴지고 한 동안 사용하지 않으면 피부결도 거칠어져요. 몇 번째 재구매할 정도로 좋습니다!,0.4296
1113,"자극없이 진짜 순해요 지금 한 3통째인가 어느순간부터 써보고 정착했어요!!!!! 무향이구요 화장솜에 덜어서 쓰는데 촉촉하고 좋아요
 무엇보다 민감성 피부인데 이걸 쓰고 좁쌀같은거 난적도 없고 도움이 됩니다",0.0047
1114,"바르기도 하고 닦기도 하고 팩으로도 쓸 수 있는
 만능 토너입니다!!!
 데일리토너로 이만한 거 이상은 없는 것 같아요~~
 각질케어랑 피부진정, 보습에 도움이 됩니다!!!
 향도 없어서 부담스럽지 않고 순해서
 정말 트러블 걱정 없이 쓸 수 있는
 토너예요~~!",0.7937
1115,"가벼운 느낌의 토너를 찾고있었는데 딱 적합한 제품인것같아요! 세안하고나서 발랐을때 피부결이 잘 정리되는 느낌을 받을 수 있었어요! 보습력은 많이 기대하지않아서 감안하고 씁니다~100ml까지 증정으로줘서 좋네요 !
 깔끔토너 가벼운토너 피부결정리",0.4504
1116,"한번 올리브영에서 써보고 계속 정착해서 쓰는 제품!!
 순하고 수렴화장수라 닦토용으로 쓰기에 정말좋아요!ㅎㅎ
 독도에도 도움되고 여러모로 정말 착한거같아요
 한번쓰면 계속 쓰게되서 지금 3통째에요 ㅎㅎ
 써보세요!!
 순한토너 독도토너 토너",0.0039
1117,"민감성피부에 짱좋아요!
 피부타입
 건성에 좋아요
 피부고민
 보습에 좋아요
 자극도
 자극없이 순해요
 이거 사기전에 리뷰에서 물바르는거같다고해서 살까말까 고민하다가 샀는데 진짜진짜진짜진짜 좋아요!!!!!!
 모든 건성 민감성분들이 사서 보셨음 좋겠어요
 한 일이주전부터 피부가 뒤집어져서 스트레스 받았는데 독도스킨으로 아침저녁 스킨팩해주니까 완전 좋아졌어요
 딱 바르자마자 피부에 자극없는 순한느낌인데 이건 진짜 써봐야 알아요! 암튼 진짜 좋고 이거랑 독도로션이랑 같이 쓰면 진짜 좋아요!",0.9734
1118,"무난무남함
 피부타입
 건성에 좋아요
 피부고민
 보습에 좋아요
 자극도
 자극없이 순해요
 라운드랩 독도토너는 사용하먄서
  자극이 없어서 좋았어요 
 일단 다른 토너제품과 크게 차이는 
 못느꼈지만 왠지 모르게 더 순한느낌이랄까??
  그렇다고 순하다!!! 이렇게 직접적으로 느껴
 지진 않아요,.그냥 더순한것 같다,ㅋㅋㅋ 
 ㅋㅋㅋㅋㅋㅋㅋㅋ
 ㅋ
 그래도 각질제거성분이들어있어서 초민감피부는 사용하지 않으시거나 닥토말고 찹토용ㅇ으로 사용하시는게 나을 것 같아요 ㅠㅠㅠ",0.9689
1119,"구입계기 : 여름 맞이 원래 쓰던 제품들이 무거운편이라 가벼운것으로 바꾸려고
 
 
 1. 미스트처럼 공병에 담아서 뿌려주면 좋다
 - 세안 후 방으로 갈때까지 건조해질까봐 미스트공병에 넣어서 촥촥 뿌려주고 가서 닦토 후 또 촥촥 뿌려주면서 3스킨정도 하고 크림 발라주는데 건조하지도 않고 피부결 아주 굿입니다
 
 2. 생각보다 수분감이 있는편
 - 겨울에 썼을때는 보습에 별로여서 괜히 샀다 싶었는데 어떤 계기로 이 제품 샘플을 여름에 쓰게 되었는데 너무 좋아서 재구매했습니다. 여름에 쓰니 속건조 없고 겉건조도 없고 딱 수분 차오르게 해주는 제품이라 좋네요.
 
 3. 각질제거가 되는듯
 - 각질제거 효과가 있다고 하셨는데 진짜 그런거 같아요. 지금 이번 여름만 세통째 사용중인데 피부결이 많이 좋아지고 가끔가다 올라오는 좁쌀여드름? 같은것들이 안나네요.",0.9684
1120,제가 사용하는 제품 중에 꾸준하게 가장 오랜 시간 함께하고 있는 제품이 독도토너인 만큼 다른 것보다 자주 구매하게 되는 것 같아요 ㅎㅎ 한 4-5년 정도 꾸준히 사용하고 있는데 저한테는 이것만큼 무난하게 사용하기 좋은 제품은 없는 것 같아요 ㅎㅎ 쭉 써오면서 항상 느끼는 점은 아무래도 물 제형 토너이다 보니까 정말 금방 닳게 된다는 점? 항상 미리 구매해두고 사용하는 편임에도 불구하고 사둬도 금방 쓰더라구요 ㅎㅎ 그 점 제외하면 더할 나위없이 좋습니다! 금방 사용하는 만큼 가격이 부담될 때도 있지만 앞으로도 리뉴얼없이 이대로만 유지되었으면 좋겠어요 ㅎㅎ,0.968
1121,"저는 항상 이거 썼다가 또 누가 좋다고 하면 귀가 얇아서 이거 쓰고 저거 쓰고 하는 토너 유목민입니다ㅠㅠ 하지만 이 독도 토너를 만나고 이마에 가득 많던 여드름이.....싹 사라져버렸어요.....!!! 진짜 신기하더라구요 그래서 이제는 로션 크림모두다 독도제품으로 변경해서 사용하고 있어요!!
 
 1️⃣ 수분감 : 저는 피부가 T존 지성 U존 건성인 피부를 갖고 있는데요, 그래서 항상 볼따구가 너무 건조해서 뭐든 미스트든 뿌려줘야 됐는데 이거 바르고 로션 바르니까 속건조 없이 너무 좋더라구요!!
 
 2️⃣ 피지가 이거 쓰고 많이 없어졌다라고 할 순 없어요 아직 제 이마에 여드름 몇 개는 남아있어서 완벽하진 않은데 가격 대비 휼륭한 토너 입니다
 
 3️⃣ 토너 양도 완전 많아서 3달 정도..? 는 쓸 수 있는 양이예요!! 가격도 저렴해서 부담없이 스킨팩을 할 수 있어서 더욱 맘에 든 토너 였어요
 
 4️⃣ 수분 충전이나 마땅한 토너를 못 고르신 뷴들께 추천드려요!!",0.9802
1122,"(2주 사용후기)
 제가 쓰던 화이트닝 제품이 단종되어 새로 정착할 곳을 찾기 위해 일주일동안 폭풍검색을 했지만 마음에 드는게 없었어요ㅠㅠㅠ
 
 그러다가 화해 어플에서❣20가지 주의성분0개❣알르레기 성분0개❣라는 것을 보고
 긴가민가 하며 '좋아봤자 얼마나 좋겠어'하는 마음으로 샀는데 와....... 정말 순해요!!! 기초라인은 마음에 딱 드는게 잘 없어서 기대 1도 안했는데 순하면서 보습효과까지 있고 무향이라서 완전만족!! 체형은 물같은 완전 액체예요
 
 저는 새제품으로 갈아타면 초반에 피부가 붉어지는데 그런거 1도 없고 여드름도 안나고 주변 지인들에게는 추천할 정도로 좋아요!!b 저처럼 고민하시는 분이 계시다면 고민하는 시간이 아까우니 얼른 주문하세용!
 (저는 솜에 토너 묻혀쓰는거 별로 안좋아해서 스킨처럼 쓰고 있는데 괜찮은 것 같아요)",0.9731
1123,"여름에 주로 사용합니다 산뜻함ㅇㅣ 좋아요 !
 추천드리고 싶어요! 가격도 굿",0.0049
1124,용량도 넉넉하고 가성비 좋게 쓸 수 있어서 좋아요. 특히 여름에는 가볍게 잘 사용할 수 있을것 같아요,0.0035
1125,"믿고쓰는 쟁여템 없으면 불안해서 사놔둠
 지금 같이 더운날에 이것저것 바르기보다는 토너 단독으로 흡수해서 바름",0.0035
1126,순한것같아용 아직 쓴ㅈㅣ 얼마안되서 잘 모르겠지만 아직 트러블은 없어요,0.0045
1127,이거는 처음 썹ㅘ용 좋다고 맨날 얘기들어서 써보게 됐어용 ~!~!,0.003
1128,"독도 토너 사용한 지 2년이 넘어갑니다. 현존하는 수분 토너중에 최고라고 자부합니다.
 
 1. 가격
 500ml에 3만원 안쪽 가격이에요 나름 합리적입니다. 
 
 2. 제형
 콧물 제형이 아닌 완전한 수분 토너에요(물 토너). 콧물 제형 토너, 스킨에 비해 촉촉함은 덜 한 편입니다.
 
 3. 효과 -추천 피부타입
 수부지! 복합성 피부타입을 가지신 분들께 추천드립니다. 
 우선 가장 효과를 본 건! 피부결이에요 피부결이 정말 아기 피부처럼 부드러워졌어요 (사용 4개월차부터) 심한 트러블 피부는 아니지만, 좁쌀 여드름이 자주 올라오는 편이고, 모공 요철이 심한 편입니다. (수부지) 그런데 이 제품은 자극도 없으면서, 얼굴의 기름기도 잡아주고 피부결도 정돈해줍니다. 약간 보습력이 있는 로션이나 크림을 함께 사용해주면 효과가 더 배로 좋을겁니다.",0.9647
1129,"독도 토너는 화해어플에서 알게되서 처음사용했구요, 사용감이 없다싶을만큼 자극적이지 않고 가벼워서 단점은 모르겠지만 그렇다고 장점도 모르겠다 싶었어요.
 닦토를 알고나서 독도토너에 신뢰도가 엄청 높아진것 같아요!!
 그전까진 500ml 구매하면 몇개월이 지나도 줄어들지가 않았는데ㅎㅎ 닦토 시작후 쑥쑥 떨어지네요
 전 화장솜에 듬뿍 묻혀서 10초~15초 팩하듯이 올려둔후 살살 닦는편이구요! 
 닦토기 피부에 안좋다는 말도 있던데 최대한 자극없이 닦으면 문제없을것 같아요.
 향은 무향이구요, 수분감이 있고 그렇진 않아요 (유분감 당연히 없구요)",0.9774
